10:47:04.328543 arp who-has zpc11.stu.neva.ru tell gpu4-gw.neva.ru
10:47:04.471846 IP ZPC15.stu.neva.ru.137 > 195.208.117.31.137: UDP, length 50
10:47:04.750464 arp who-has zpc18.stu.neva.ru tell gpu4-gw.neva.ru
10:47:04.878414 arp who-has zpc4.stu.neva.ru tell gpu4-gw.neva.ru
10:47:04.912906 IP ZPC15.stu.neva.ru.51508 > ns.stu.neva.ru.53:  29703+ PTR? 11.117.208.195.in-addr.arpa. (45)
10:47:04.913637 IP ns.stu.neva.ru.53 > ZPC15.stu.neva.ru.51508:  29703* 1/2/4 (225)
10:47:05.121441 IP zpc15.stu.neva.ru.1900 > 239.255.255.250.1900: UDP, length 274
10:47:05.179568 arp who-has etable1.stu.neva.ru tell gpu4-gw.neva.ru
10:47:05.196631 802.1d unknown version
10:47:05.199392 IP zpc15.stu.neva.ru.1900 > 239.255.255.250.1900: UDP, length 328
10:47:05.230517 IP zpc15.stu.neva.ru.1900 > 239.255.255.250.1900: UDP, length 330
10:47:05.277289 IP zpc15.stu.neva.ru.1900 > 239.255.255.250.1900: UDP, length 283
10:47:05.324161 IP zpc15.stu.neva.ru.1900 > 239.255.255.250.1900: UDP, length 340
10:47:05.324248 IP zpc15.stu.neva.ru.1900 > 239.255.255.250.1900: UDP, length 338
10:47:05.390493 arp who-has zpc11.stu.neva.ru tell gpu4-gw.neva.ru
10:47:05.408216 
